{
  "schema_version": "1.0.0",
  "cve_id": "CVE-2026-25949",
  "nixpkgs_rev": "55b908383f4d5bfee96f5cca0effc66c80893984",
  "blast_radius_threshold": 500,
  "threshold_policy": "v0-default",
  "affected_attr_paths": ["traefik"],
  "reverse_closure_count": 3,
  "reverse_closure_bucket": "<50",
  "reverse_closure_sample": ["nixosTests.traefik"],
  "critical_downstreams": [],
  "exceeds_threshold": false,
  "per_attr": [
    {
      "attr_path": "traefik",
      "drv_path": "/nix/store/00000000000000000000000000000001-traefik-3.6.7.drv",
      "reverse_closure_count": 3,
      "reverse_closure_bucket": "<50",
      "reverse_closure_sample": ["nixosTests.traefik"],
      "critical_downstreams": [],
      "exceeds_threshold": false
    }
  ],
  "replay_critical": true
}
