{
  "schema_version": "1.0.0",
  "cve_id": "CVE-2025-7207",
  "nixpkgs_rev": "a08477a48bee5d7617c168aed10febeb1386dac3",
  "blast_radius_threshold": 500,
  "threshold_policy": "v0-default",
  "affected_attr_paths": ["mruby"],
  "reverse_closure_count": 3,
  "reverse_closure_bucket": "<50",
  "reverse_closure_sample": [
    "mruby"
  ],
  "critical_downstreams": [],
  "exceeds_threshold": false,
  "per_attr": [
    {
      "attr_path": "mruby",
      "drv_path": "/nix/store/00000000000000000000000000000005-mruby-3.3.0.drv",
      "reverse_closure_count": 3,
      "reverse_closure_bucket": "<50",
      "reverse_closure_sample": ["mruby"],
      "critical_downstreams": [],
      "exceeds_threshold": false
    }
  ],
  "replay_critical": true
}
